[
  {
    "id": "squat.barbell.high-bar",
    "names": ["High-Bar Back Squat", "Barbell Back Squat"],
    "facets": {
      "modality": "strength",
      "movementPattern": "squat",
      "anatomy": { "primary": ["quadriceps", "glutes"], "secondary": ["adductors", "spinal-erectors"] },
      "mechanic": "compound",
      "equipment": "barbell",
      "barPosition": "high-bar",
      "laterality": "bilateral"
    },
    "attributes": { "met": 6.0 },
    "source": "curated",
    "variations": ["squat.barbell.front"]
  },
  {
    "id": "deadlift.barbell.conventional",
    "names": ["Conventional Deadlift"],
    "facets": {
      "modality": "strength",
      "movementPattern": "hinge",
      "anatomy": { "primary": ["glutes", "hamstrings", "spinal-erectors"], "secondary": ["lats", "trapezius"] },
      "mechanic": "compound",
      "equipment": "barbell",
      "stance": "conventional",
      "laterality": "bilateral"
    },
    "attributes": { "met": 6.0 },
    "source": "curated"
  },
  {
    "id": "bench-press.barbell.flat",
    "names": ["Flat Barbell Bench Press", "Bench Press"],
    "facets": {
      "modality": "strength",
      "movementPattern": "horizontal-push",
      "anatomy": { "primary": ["pectoralis-major"], "secondary": ["triceps", "anterior-deltoid"] },
      "mechanic": "compound",
      "equipment": "barbell",
      "laterality": "bilateral"
    },
    "attributes": { "met": 5.0 },
    "coded": { "wger": 73 },
    "source": "curated"
  },
  {
    "id": "overhead-press.barbell",
    "names": ["Overhead Press", "Strict Press"],
    "facets": {
      "modality": "strength",
      "movementPattern": "vertical-push",
      "anatomy": { "primary": ["anterior-deltoid"], "secondary": ["triceps", "upper-trapezius"] },
      "mechanic": "compound",
      "equipment": "barbell",
      "laterality": "bilateral"
    },
    "attributes": { "met": 5.0 },
    "source": "curated"
  },
  {
    "id": "pull-up",
    "names": ["Pull-Up"],
    "facets": {
      "modality": "strength",
      "movementPattern": "vertical-pull",
      "anatomy": { "primary": ["lats"], "secondary": ["biceps", "rhomboids"] },
      "mechanic": "compound",
      "equipment": "bodyweight",
      "grip": "pronated",
      "laterality": "bilateral"
    },
    "attributes": { "met": 8.0 },
    "source": "curated",
    "regressions": ["lat-pulldown.cable"],
    "progressions": ["muscle-up"]
  },
  {
    "id": "curl.dumbbell",
    "names": ["Dumbbell Biceps Curl"],
    "facets": {
      "modality": "strength",
      "movementPattern": "elbow-flexion",
      "anatomy": { "primary": ["biceps"], "secondary": ["brachioradialis"] },
      "mechanic": "isolation",
      "equipment": "dumbbell",
      "laterality": "alternating"
    },
    "attributes": { "met": 3.5 },
    "source": "curated"
  },
  {
    "id": "thruster.barbell",
    "names": ["Barbell Thruster"],
    "facets": {
      "modality": "functional",
      "movementPattern": "squat-to-press",
      "anatomy": { "primary": ["quadriceps", "anterior-deltoid"], "secondary": ["glutes", "triceps"] },
      "mechanic": "compound",
      "equipment": "barbell",
      "laterality": "bilateral"
    },
    "attributes": { "met": 8.0 },
    "source": "curated"
  },
  {
    "id": "run",
    "names": ["Running"],
    "facets": {
      "modality": "endurance",
      "movementPattern": "gait",
      "anatomy": { "primary": ["quadriceps", "hamstrings", "calves"], "secondary": ["glutes"] },
      "mechanic": "compound",
      "equipment": "none"
    },
    "attributes": { "met": 9.8 },
    "coded": { "healthkit": "running" },
    "source": "compendium"
  },
  {
    "id": "row.erg",
    "names": ["Rowing (Ergometer)", "Indoor Row"],
    "facets": {
      "modality": "endurance",
      "movementPattern": "row",
      "anatomy": { "primary": ["lats", "quadriceps"], "secondary": ["hamstrings", "biceps"] },
      "mechanic": "compound",
      "equipment": "machine"
    },
    "attributes": { "met": 7.0 },
    "source": "compendium"
  },
  {
    "id": "plank",
    "names": ["Front Plank"],
    "facets": {
      "modality": "mobility",
      "movementPattern": "anti-extension",
      "anatomy": { "primary": ["rectus-abdominis", "transverse-abdominis"], "secondary": ["obliques"] },
      "mechanic": "isolation",
      "equipment": "bodyweight",
      "laterality": "bilateral"
    },
    "attributes": { "met": 3.8 },
    "source": "curated"
  },
  {
    "id": "hamstring-stretch.standing",
    "names": ["Standing Hamstring Stretch"],
    "facets": {
      "modality": "flexibility",
      "movementPattern": "static-stretch",
      "anatomy": { "primary": ["hamstrings"] },
      "mechanic": "isolation",
      "equipment": "none",
      "rangeOfMotion": "full"
    },
    "attributes": { "met": 2.3 },
    "source": "curated"
  },
  {
    "id": "squat.barbell.front",
    "names": ["Front Squat", "Barbell Front Squat"],
    "facets": {
      "modality": "strength",
      "movementPattern": "squat",
      "anatomy": { "primary": ["quadriceps", "glutes"], "secondary": ["core", "upper-back"] },
      "mechanic": "compound",
      "equipment": "barbell",
      "barPosition": "front",
      "laterality": "bilateral"
    },
    "attributes": { "met": 6.0 },
    "source": "curated",
    "variations": ["squat.barbell.high-bar"]
  },
  {
    "id": "deadlift.barbell.romanian",
    "names": ["Romanian Deadlift", "RDL"],
    "facets": {
      "modality": "strength",
      "movementPattern": "hinge",
      "anatomy": { "primary": ["hamstrings", "glutes"], "secondary": ["spinal-erectors", "lats"] },
      "mechanic": "compound",
      "equipment": "barbell",
      "stance": "romanian",
      "laterality": "bilateral"
    },
    "attributes": { "met": 6.0 },
    "source": "curated"
  },
  {
    "id": "row.barbell.bent-over",
    "names": ["Bent-Over Barbell Row"],
    "facets": {
      "modality": "strength",
      "movementPattern": "horizontal-pull",
      "anatomy": { "primary": ["lats", "rhomboids"], "secondary": ["biceps", "spinal-erectors"] },
      "mechanic": "compound",
      "equipment": "barbell",
      "stance": "bent-over",
      "laterality": "bilateral"
    },
    "attributes": { "met": 5.0 },
    "source": "curated"
  },
  {
    "id": "lat-pulldown.cable",
    "names": ["Lat Pulldown"],
    "facets": {
      "modality": "strength",
      "movementPattern": "vertical-pull",
      "anatomy": { "primary": ["lats"], "secondary": ["biceps", "rhomboids"] },
      "mechanic": "compound",
      "equipment": "cable",
      "laterality": "bilateral"
    },
    "attributes": { "met": 5.0 },
    "source": "curated",
    "progressions": ["pull-up"]
  },
  {
    "id": "push-up",
    "names": ["Push-Up"],
    "facets": {
      "modality": "strength",
      "movementPattern": "horizontal-push",
      "anatomy": { "primary": ["pectoralis-major"], "secondary": ["triceps", "anterior-deltoid"] },
      "mechanic": "compound",
      "equipment": "bodyweight",
      "laterality": "bilateral"
    },
    "attributes": { "met": 3.8 },
    "source": "curated"
  },
  {
    "id": "dip",
    "names": ["Dip", "Parallel Bar Dip"],
    "facets": {
      "modality": "strength",
      "movementPattern": "vertical-push",
      "anatomy": { "primary": ["pectoralis-major", "triceps"], "secondary": ["anterior-deltoid"] },
      "mechanic": "compound",
      "equipment": "bodyweight",
      "laterality": "bilateral"
    },
    "attributes": { "met": 5.0 },
    "source": "curated",
    "progressions": ["muscle-up", "dip.rings"],
    "regressions": ["dip.machine"]
  },
  {
    "id": "muscle-up",
    "names": ["Muscle-Up"],
    "facets": {
      "modality": "skill",
      "movementPattern": "vertical-pull",
      "anatomy": { "primary": ["lats", "pectoralis-major"], "secondary": ["triceps", "biceps"] },
      "mechanic": "compound",
      "equipment": "bodyweight",
      "laterality": "bilateral"
    },
    "attributes": { "met": 8.0 },
    "source": "curated",
    "regressions": ["pull-up", "dip"]
  },
  {
    "id": "pistol-squat",
    "names": ["Pistol Squat", "Single-Leg Squat"],
    "facets": {
      "modality": "strength",
      "movementPattern": "squat",
      "anatomy": { "primary": ["quadriceps", "glutes"], "secondary": ["adductors"] },
      "mechanic": "compound",
      "equipment": "bodyweight",
      "laterality": "alternating"
    },
    "attributes": { "met": 8.0 },
    "source": "curated"
  },
  {
    "id": "handstand",
    "names": ["Handstand"],
    "facets": {
      "modality": "skill",
      "movementPattern": "isometric-hold",
      "anatomy": { "primary": ["deltoids"], "secondary": ["core", "triceps"] },
      "mechanic": "compound",
      "equipment": "bodyweight",
      "laterality": "bilateral"
    },
    "attributes": { "met": 4.0 },
    "source": "curated"
  },
  {
    "id": "l-sit",
    "names": ["L-Sit"],
    "facets": {
      "modality": "skill",
      "movementPattern": "isometric-hold",
      "anatomy": { "primary": ["rectus-abdominis", "hip-flexors"], "secondary": ["triceps"] },
      "mechanic": "compound",
      "equipment": "bodyweight",
      "laterality": "bilateral"
    },
    "attributes": { "met": 4.0 },
    "source": "curated"
  },
  {
    "id": "clean-and-jerk.barbell",
    "names": ["Clean and Jerk"],
    "facets": {
      "modality": "power",
      "movementPattern": "clean",
      "anatomy": { "primary": ["glutes", "quadriceps", "deltoids"], "secondary": ["trapezius", "hamstrings"] },
      "mechanic": "compound",
      "equipment": "barbell",
      "laterality": "bilateral"
    },
    "attributes": { "met": 6.0 },
    "source": "curated"
  },
  {
    "id": "snatch.barbell",
    "names": ["Snatch", "Barbell Snatch"],
    "facets": {
      "modality": "power",
      "movementPattern": "snatch",
      "anatomy": { "primary": ["glutes", "deltoids", "trapezius"], "secondary": ["quadriceps", "hamstrings"] },
      "mechanic": "compound",
      "equipment": "barbell",
      "laterality": "bilateral"
    },